{
  "timestamp": "2025-10-23T02:56:21.906341",
  "test_type": "multi_target_hunting",
  "targets_tested": 106,
  "findings": [
    {
      "type": "Subdomain Takeover",
      "severity": "Critical",
      "target": "Square",
      "subdomain": "block-ca.squareup.com",
      "cname": "d21ajmrv1bc274.cloudfront.net",
      "service": "AWS CloudFront",
      "bounty_range": "$500-$2000",
      "hackerone_report": "# Subdomain Takeover Vulnerability - block-ca.squareup.com\n\n## Summary\nThe subdomain `block-ca.squareup.com` has a CNAME record pointing to `d21ajmrv1bc274.cloudfront.net` (AWS CloudFront), but the resource is unclaimed. This allows an attacker to claim the resource and serve malicious content under your domain.\n\n## Severity\n**Critical** - Subdomain takeover allows attackers to:\n- Serve phishing pages under your domain\n- Steal cookies and session tokens\n- Bypass CSP and CORS policies\n- Damage brand reputation\n\n## Reproduction Steps\n\n1. Check DNS CNAME record:\n```bash\ndig block-ca.squareup.com CNAME\n```\n\nOutput shows: `d21ajmrv1bc274.cloudfront.net`\n\n2. Visit the subdomain:\n```bash\ncurl -I https://block-ca.squareup.com\n```\n\nResponse shows the service is unclaimed.\n\n3. Claim the resource on AWS CloudFront:\n   - Create account on AWS CloudFront\n   - Claim the resource name from the CNAME\n   - Verify you can now serve content under `block-ca.squareup.com`\n\n## Impact\n- Full control over subdomain content\n- Ability to steal credentials via phishing\n- Cookie theft (if cookies are scoped to parent domain)\n- Bypass of security policies (CSP, CORS)\n- Brand damage and loss of customer trust\n\n## Mitigation\n1. Remove the CNAME record for `block-ca.squareup.com` from your DNS configuration\n2. OR claim the resource on AWS CloudFront yourself\n3. Implement monitoring for dangling DNS records\n\n## Supporting Evidence\n- DNS CNAME: `d21ajmrv1bc274.cloudfront.net`\n- Service: AWS CloudFront\n- Discovered: 2025-10-23T02:16:08.753611\n\n## Expected Bounty Range\n$500-$2000",
      "verified": true,
      "poc_file": "/Users/daniel/Documents/aicode/hackerone/pocs/poc_Square_Subdomain_Takeover_20251023_025621.md"
    }
  ],
  "total_findings": 1
}