{
  "timestamp": "2025-10-21T20:35:02.987447",
  "test_type": "multi_target_hunting",
  "targets_tested": 106,
  "findings": [
    {
      "type": "Subdomain Takeover",
      "severity": "Critical",
      "target": "Signal",
      "subdomain": "cdn-ca.signal.org",
      "cname": "d3qci4gamqr675.cloudfront.net",
      "service": "AWS CloudFront",
      "bounty_range": "$500-$2000",
      "hackerone_report": "# Subdomain Takeover Vulnerability - cdn-ca.signal.org\n\n## Summary\nThe subdomain `cdn-ca.signal.org` has a CNAME record pointing to `d3qci4gamqr675.cloudfront.net` (AWS CloudFront), but the resource is unclaimed. This allows an attacker to claim the resource and serve malicious content under your domain.\n\n## Severity\n**Critical** - Subdomain takeover allows attackers to:\n- Serve phishing pages under your domain\n- Steal cookies and session tokens\n- Bypass CSP and CORS policies\n- Damage brand reputation\n\n## Reproduction Steps\n\n1. Check DNS CNAME record:\n```bash\ndig cdn-ca.signal.org CNAME\n```\n\nOutput shows: `d3qci4gamqr675.cloudfront.net`\n\n2. Visit the subdomain:\n```bash\ncurl -I https://cdn-ca.signal.org\n```\n\nResponse shows the service is unclaimed.\n\n3. Claim the resource on AWS CloudFront:\n   - Create account on AWS CloudFront\n   - Claim the resource name from the CNAME\n   - Verify you can now serve content under `cdn-ca.signal.org`\n\n## Impact\n- Full control over subdomain content\n- Ability to steal credentials via phishing\n- Cookie theft (if cookies are scoped to parent domain)\n- Bypass of security policies (CSP, CORS)\n- Brand damage and loss of customer trust\n\n## Mitigation\n1. Remove the CNAME record for `cdn-ca.signal.org` from your DNS configuration\n2. OR claim the resource on AWS CloudFront yourself\n3. Implement monitoring for dangling DNS records\n\n## Supporting Evidence\n- DNS CNAME: `d3qci4gamqr675.cloudfront.net`\n- Service: AWS CloudFront\n- Discovered: 2025-10-21T20:33:53.210882\n\n## Expected Bounty Range\n$500-$2000",
      "verified": true,
      "poc_file": "/Users/daniel/Documents/aicode/hackerone/pocs/poc_Signal_Subdomain_Takeover_20251021_203502.md"
    }
  ],
  "total_findings": 1
}